4 stars for the fun factory, games, and all around experience, but 2 stars for the disgusting food and horrible service!i was so excited to come here for my boyfriends birthday. its always fun to play games, win tickets, and have fun with friendsfamily. we decided to eat here before we played. i keep seeing commercials for their new menu, so hey it couldnt be bad right? wrong! only thing that was really good was the coronarita  but thats hard to mess up. first off, service was horrible. i didnt feel like any of the areas were that packed to make the service so slow, but apparently i was wrong. it took about 15 minutes, minimum, to get our first drinks. at least an hour for our food. i have boneless buffalo wings, which are hard to screw up, so mine werent bad but they werent the best. my boyfriend had their philly cheesesteak and he couldnt finish it. was so salty and just not good. for the price of everything, it was not worth it all. better off going somewhere else in the waterfront for food and then coming here to play. youll save , time, and frustration! i guess they are also remodeling their price area so for now there is a makeshift area to cash in your tickets. everything was pretty picked over, which kinda sucked. overall it was still fun, and i am sure i will be back to play some more games!
can we get a maintenance man?  and a janitor?  and a manager?   no?  ok...i had a good time at dave and busters, but that was based mainly on the company i kept and not the venue.   we went right when they opened for the day, with the intention of playing some pool.  we located the pool tables in an area that looked closed off, so we went to the hostess stand to ask.  she radioed for help, got none, and finally went in search of an answer our question.  when she came back, she said she couldnt find anyone, but a manager would be out to talk to us.   we wait...and wait...and finally just give up and go off to play in the arcade area.   all but one of the card purchase machines were rebooting, and the one we could use didnt work.  it takes forever and finally gives up and directs us to a nonexistent ticketing attendant.  so we again go off in search of someone to help.  we flagged down a server, who issued us a card 56 for 375 tokens and served us a few cocktails average prices, though my rum and coke was teeny.   and we are off to play some games.  about every third game we tried was broken in some way.  either the token swipe didnt work or the game itself was messed up.   it also wasnt the cleanest place ive ever seen.  they have tables around the place to set your drinks on, but most of them didnt look as though theyd been wiped from the day before which of course makes we wonder when they last cleaned all the games that germy little kids touch all day.overall, they appeared completely unprepared for opening computers booting, employees not ready to work, soda gun at the bar not assembled, etc. and not well maintained or managed at all.  the broken games were sort of comical after a while, but definitely not in a good way.  if you are really looking to do this type of activity, id try a different location for sure.
over priced, over hyped but a hell of a time regardless.  i think if you have a big screen tv at home and a wii you could order pizza get beer and have friends over and have the same experience without the price and glitz.  ive yet to eat something here that impressed me.  the arcade is a bit dated but i like playing the big trivia game more than anything again, you could just invite people over to play trivial pursuit.  the new tv set up is pretty cool, but dave and busters is just what it is, an adult chuckie cheese not worth more than a visit a year, if that.
i ate here for lunch today with my wife and 2 kids. server was prompt getting to the table, took our order and then disappeared. our food took 25 minutes yet there was only 4 table with people who were dining. grilled cheese, salad and a quesadilla shouldnt take that long. games were fine. mens room didnt have any paper towels to dry hands with. huge fail for this type of venue.
i have been to dave and busters multiple times and i feel its a 2 star place.i can say the food quality is sub par.  in my opinion the food prices are expensive for what it is and quality.  they do offer a nice bar,but then again the prices in my opinion are a little higher.  service isnt too bad, but could be better.db is a great place for adults for sure, but the prices for tokes or game play is a little ridiculous.  some games charge 6.9 credits to place.  thats almost saying 1.50 a game and some of those games are addicting where i know most of us keep playing.  i also thing db isnt the cleanest place either.  the bathrooms near the arcade are always nasty in my opinion.  doesnt seem like they keep up with it.  to me, thats a big factor in rating restaurants.   all in all, db is an ok place to visit, but not a place i would frequently waste my money.
the food here is awful.  i came with a small group of people for dinner one night before heading out bar hopping at a few places at the waterfront.  we gave the server the benefit of the doubt because there were about 8 of us, which can be challenging.  i think the long wait time to get the drinks and then the food was due to the bartender and kitchen, but the waitress really tried her best.i only gave it 2 stars because i liked my mac and cheese.  everyone else at the table hated their food.  they all had sandwiches or other dishes.  the one girl resorted to eating only the toppings off her sandwich because the bread was too hard to bite through.  the kitchen probably made her sandwich right away and left it under the heating lamps for 40 minutes while preparing the rest of our tables food.i was tempted to stop and play games for a couple minutes, but after my husband came out of the restroom he told me how about 5 other guys walked out of the restroom as well that had not washed their hands and immediately went over to start playing games.  all i have to say is no thanks.
the food was good but we waited an hour for our drinks then 1.5 hours food then an hour for our bill. wont be back! not busy at all so not sure what the problem was. id hate to be there when they are busy.
eh i was disappointed. the food wasnt so good and the place had a weird smell to it. at least the waitress was pleasant. probably wont be returning anytime soon unless they make some changes
summary:if i was in the area and no one had a better suggestion for where to go, i might come back for beer and appetizers.good: decent beer... original pretzel appetizer.  you take chunks of soft pretzel and dunk it in spinach cheese dip. huge portions.  most of us had leftovers.  the rb appetizer sampler was multistory and way more food that we could handle.  the half order of ribs looked like a full rack. attentive service with quick seating and frequent drinkwater refills. amusing name.bad: lots of food choices... burgers... steak... chicken... salads.  lots of drink choices... beers... wines... mixed drinks.  i guess this could be seen as good, but it takes a while for everyone to pick something and since no ones awesome at everything, you could tell right away that nothing distinguishes this place. none of the food was super awesome.  nothing was awful, but nothing stood out in any way.  ive had better beer, appetizers, and a better main course at plenty of breweries. kind of dead on a monday night with 34 of the place empty.come if you want bar food, but keep your expectations low.
microbrewed beers are only a plus to me when theyre better than the beer i would have drank otherwise.  one waitress i had while there tried to split the uprights between macrobrew and trendy by describing one of their beers as kind of like coors light.  if i wanted coors, ill pay half as much and have one.  the food is actually a saving grace, as it was pretty good.  head next door to sing sing for drinks, though.
lately, the rock bottom is hit or miss. the beers are always good and the uppity jagoff ipa is one of the best india pale ales ive ever tasted. the low point lately has been the food. i will never forgive the idiot in management who took the chicken quesadilla off the menu. that said, i ordered the lobster roll and when it arrived, the bread was as hard as a brick and cold. the filling was okay, but the lobster flavor was masked by over spicing. i suggest you eat somewhere else and imbibe at the rock bottom.
i always feel like i am constantly bashing breweries for their food, but in my opinion, i feel the bar is raised for places like this. it seems there are so many breweries out there that offer great beer, and slack off on the food. unfortunately rock bottom is one that falls into that category. lets be honest, when you go to a brewery, you want the full experience. if it was only about the beer, id go buy a growler and take it home. so, about the beer....excellent!!!!! the jagoff ipa is with out a doubt one of the best ipas i have ever had! they only i can think of that i think is better is dogfish head, but thats a matter of opinion. the beer selection is constantly changing, and they always have some excellent seasonal beers. you cant go wrong, theres bound to be a beer everyone will like. as for the food.......its pretty much a crap shoot. sometimes its good, sometimes its terrible. my biggest problem is there is absolutely no consistency when it comes to the food. one time its perfect, then maybe its cold, or its burned, or it tastes completely different from the last time you had it. unfortunately, it seems there is zero attention to food quality. thats pretty much it. this place fixes its food consistency, and its a five star place. till then, its hit or miss!
i must admit, i do like the brews.  i also like the white cheddar mash potatoes.  other than that, meh.  the food is pretty forgettable.  another brewery that sadly fails to be anything special in the food department.  with the restaurants upping the ante on 8th ave, you may want to kick it up a notch rock bottom.  but how would anyone know to?  its a chain.  whomp whomp!
i went to rock bottom this past weekend, and it was nice to see that nothing has changed in the year or two since my last visit. while the beer is pretty good, it has never outweighed the fact that the service isnt good and the food is average, at best.it was even difficult to get beers at the bar...we tried to have the girls order, thinking theyd have better luck...when that failed, the men tried...that didnt work either. if we hadnt really wanted a cold beer after a comedy show at the improv, we wouldve just left. it definitely wasnt busy enough to be noticed and ignored by the bartender, so i cant overlook it. of course, the service has always been spotty at rock bottom, so it was hardly surprising.combine the weak food and poor service with rock bottom being too far from home for a night out just to drink, and you get the exact formula thats kept me from going there in the past...and will keep me from going often in the future.
slow servicebelow average food ill pass
rock bottom is a chain brew pub one that, in my opinion, is just ok.  the restaurant is rather large with lots of seating and a pool table. they have many of their own brews that you can sample but to tell you the truth none of them are that good. i have had several of their beers and all of them have been forgettable. their food is pretty much like their beers, forgettable. i have had one of their burgers and their pizza and they really werent anything to write home about.i feel they will impress those who have never been to a brew pub but i would probably describe them as the chilis of brew pubs. if you are in homestead and are looking for a burger and a beer it might be a good choice for a bite, or at least until the burgatory opens!
went here last night to meet folks for a friends birthday party. docking one star due to a few unfortunate things that happened, otherwise id be fine giving this place a 3.our waiter was very attentive and kept our water and soda cups refilled, the food was decent overall  i had a plain ol burger and a delicious berry sangria  and the place overall had a nice vibe to it and was pretty comfortable and fun to be in...youd think this would just be another average place notgreatbutnotbad and id be ready to go on to the next review right there.heres where i ran into problems. id checked the website in advance to try and plan my meal since i do my best to pick items on menus that arent, say, 2,000 calories in one sitting. their website advertises that they make skinny drinks; when i asked my waiter he said it was possible but that they did not normally do this and that its a hassle for the people at the bar, so he didnt recommend it. then why tell us on your website that youll do it??? additionally, while we had checked in advance when we made our reservation about bringing a birthday cake and the restaurants ability to handle us lighting candles, apparently there was a break down in communication; we never got the candles we had asked for, and in fact the poor waiter struggled to even find a lighter before realizing there were no candles available. obviously whatever error occurred wasnt the waiters fault, and we definitely thanked him and tipped him well for doing the best that he could with what he had. on a final note, this is also one of those places where if you ask for a medium rare burger, they will overcook it; ive started ordering medium rare on purpose specifically so that i get a medium cooked burger instead of medium well or well done.final verdict: go for the brews if you must, and the foods nice enough. i was admittedly left a little underwhelmed.
so after an evening of enjoying a comedy show at the waterfront, we headed to rock bottom for some late night grub.  the place was pretty busy, we had to walk around the bar area for several minutes until a nice couple told us they were about to leave and we could have their bar table.  as nice as this was of them it was awkward standing over them as they finished their drinks paid their bill and left.  so finally seated i look over the drinks and being the huge ipa lover that i am i went with that and it was indeed a good choice.  the hubby had the red ale which was also rather good.the service was ok, not the best not the worst.  but moving on to more important thing, the food.  talk about missing the mark hugely!  i ordered the mini street fish tacos.  you get four mini tacos with a marinated in lime piece of fish, and tomatillo salsa.  they were just strokes away from inedible.  i love fish tacos, i mean it is such a simple concept so why do people have such a hard time executing this dish? the shells were hard and literally split at the bottom when i picked them up.  the sour cream sprayed all over the plate only made them messy and the poor fish was just so overcooked.  if i wasnt so hungry i wouldnt have eaten them at all! lesson learn on that.the husband had the bbq chicken pizza.  it had beans and corn with roasted red pepper on it along with some sour cream.  my husband is usually the type that will order these lovely specialty pizzas and ask for them to remove all the wonderful unique toppings!  for instance, he would usually just say, chicken bbq and cheese, nothing else!  i refused to let him do that this time, because i was really intrigued in the combination of ingredients on this pie.  and boy was i jealous when it came out.  it blew my crappy tacos out of the water!  should have stuck with something simple.  furthermore i could care less if i come back to this location.  the beers were good but hell you can get a decent ipa just about anywhere anymore.  and the underwhelming food sealed the deal.  i know this is a chain, but it still doesnt have to stink...
the food is standard american farea bit overpriced in my mindand the beers range from mediocre to very bad.  the kolsch is the only decent beer of the bunch.  the service is good, but the wait for food or a table can be quite long generally 2030 minutes even for just beer and apps.  ive been to the one at the denver airport as well, but i was stranded and had free meal tickets, so okaybutnothingspecial pizza from rock bottom it was.  since its a recognizable national chain, i think of places like this as more of a tourist brewery rather than a true pittsburgh craftbrew experience.
the beer is good but the food is nothing to brag about at all. ive tried many things on the menu, and if you have developed a foodie palate, dont even bother, because you will be very disappointed. if you feel comfortable with chain restaurants and their lack of innovative touch which, nothing wrong with that! you will most likely enjoy rockbottom. the only entree i did enjoy were the lobster and shrimp enchiladas minus the repulsive beans and rice and the asiago crab dip as an appetizer. otherwise, you are better off skipping it.
for this occasion i was with my girls, we were looking for a place to have a good lunch.  we looked around and chose rock bottom, we have eaten then before and enjoyed ourselves.  the server was a very nice person and was very attentive.  she when over the specials and took our drink order.   going through the menu one thing that caught my eye was the bbq brisket stuffed burger.  that just sounded so good.  unfortunately the reality didnt match the idea of the burger.  the favor of the bbq never came through and the smoked gouda flavor was none existent. it was like having a standard old boring burger.  i was very disappointed.  for 14, i would have expected a lot more flavor.  i would not recommend this burger unless they do something to bunch up the flavor.
overpriced. food is ok, but way overpriced. quantities are small....much smaller than the picture in the menu. the beer is average. but yes, you guessed it, thats overpriced too.
was hoping for a great end of a day experience, but...... things happen. waitress seemed to have forgotten about us, entrees came out prior to our appetizers. entree of fish chips was a major disappointment, fish was soggy and the chips were cold and grainy.starters were comped but i doubt wed go back. sad because it has the potential to be a home run hitter. two stars and thats it.
rock bottom: a cautionary yelpers tale.you might say, ive never heard of rock bottom, theres no way that they are a chain restaurant. beer? apps? bros? sounds like a good time, but be careful or youll end up on the rock bottom.after a 30 minute wait staring at half of an empty restaurant with the usual goofy decor you would find at a buffalo wild wings, we were finally seated. we could feel the tension from other diners that something wasnt right. the manger was running around apologetically and the food was casually sunbathing under the heat lamps. we immediately ordered a few apps but just like got, and now our watch begins.we waited and waited to finally receive the saddest, tiniest plates of food with bloated chain restaurant prices. the food was uninspired, tired, and ordinary. the only reason why i am giving them 2 stars is because of the extremely gracious and apologetic wait staff who took off 20 of our meal due to the terrible service. so if you have decided to take a seat at rock bottom, take comfort in knowing that even the staff seems to know your pain.
while this is certainly not my first meal at rock bottom, this is my first meal in a year or two . the wait was minuscule, and the greeter was pleasant. as always it is a haircut weekend so the twin carnivores, the mother in law and i decided to tie the feed bag on at rb. our server matt was easy to work with and informative. i started off with the tortilla soup. spicy and thick it went down easy enough. however let me say that the price at 3.50 was rather steep for the serving size. did somebody say ouch!! thing one and thing two each had the small fry steaks  with fruit cantaloupe, melons, and grapes and steamed broccoli and at 6.75 each, i think i was buffaloed if  you get my drift. the steak consisted of three small thinly sliced pieces of .... hmmm. they say that kids say the darnedest things well thing one noticed that his steak was very very gristly, and thing two noticed that his was rather dry. not the best dinner they have eaten. they say you get what you pay for or not!!  my meal consisted of the chicken bacon mac  cheese  and at 14.75 i had no complaints. it was filing hot and load with chicken and bacon. how can anything be wrong with that much bacon!!! the final dinner consisted of chicken fried chicken and at 13.95 my mother in law was sated. over all this meal was a wash. if anyone from rock bottom corporate reads this... you may seriously want to rethink you portion sizes. as you know i vote with my feet and dollars, and neither will be there again any time soon!!
this is another one of my favorite places that had deteriorated dramatically. corporate decided to get rid of the core beers and the beers now suck. the menu has gone from something for everyone to a couple of overpriced entrees and a bunch of small plates that are ok but not great. the service has also suffered tremendously. we are abandoning this restaurant.i dont expect this rock bottom to be around too much longer.  in the past, on nights when the pirates were playing out of town, the bar and the restaurant would be packed.  last night, it was only slightly busy.  you can usually tell when an eatery is suffering by the amount of staff on a given night and the conditions of the bathroom.  the staff was overwhelmed and the bathrooms were filthy and in serious need of repairs.  alas, i dont think that rock bottom will still be in business in six months.  hopefully, if that happens, black rock bar  steak house will find its way into pittsburgh.
stopped in for dinner an bellied up to the bar. the bar tender was quick to get me a beer the 3 pepper ale which was really good but after that i was totally ignored. tried to get the attention of the two bartenders for about a half hour while nursing my beer. they seemed to be more interested in changing dollars for quarters and washing glasses. i got feed up, finished my beer, paid my tab and went to unos. glad i did... got great service and my meal came quickly.verdict:  sit at the bar for a beer if thats what you want but if youre hungry and want dinner take your chances at a table.
service is good, staff is friendly and knowledgeable. beer and cocktails are good as well. food...not so much.  my boyfriend and i shared the jalapeno pretzel appetizer which was pretty good, but our entrees.... disappointing.  i got the baja chicken sandwich and he got the bison burger.   both were super dry. i could not even finish half of mine. he had to drench his in ketchup to be able to get the bison burger down. if i were to go back, it certainly would not be to eat.
meh is the only thing i leave here feeling.  i ordered the classic burger because nothing on the new menu excited me.  for a side,  i requested the seasonal veggies trying to be healthier and was told its a squash mixture  great i love summer squash!  i received a poorly seasoned burger. the bun had the most flavor which is a sad statement.  it was topped with an olive and a mini pickle... odd.  my squash side was lacking squash. instead all squash was replaced by peppers... which i cannot eat.our server was nice.  the beer was simple.  with new breweries and restaurants popping up in and around homestead, perhaps rb should reconsider their flavors.
overpriced. food is ok, but way overpriced. quantities are small....much smaller than the picture in the menu. the beer is average. butbyes
the place does what it does best  comedy.  the food, however.  blah.first off, if you go to a show, please note there is a two item per person minimum.  this means that from their extensive menu of overpriced bar food and drinks, you are required to choose two items each.    second, the sodas are not free refills!  i learned that one the hard way.  get water. third, before tipping your server, please make sure she hasnt already taken her cut out.  even after paying for two very bland, overpriced meals and way too many diet cokes, i thought that my bill was rather high.  upon further inspection, i noticed that my server had taken an 18 gratuity.  the menu explicitly says that an automatic gratuity will be taken out for parties of six or more, but there was only two of us and we werent even drunk.  i found this tactic awfully presumptuous and left her tip at the 18 even though i typically tip well over 20.    overall, i dont like the idea of being required to purchase food just to see a comedy show.  i can see why they do it, but if i were required to buy a crappy popcorn and overpriced pop every time i went to the movies, i would be far less inclined to go as i am not inclined to go to the improv again.
