if there was ever a get your coffee and go starbucks, this is it. right in the center of the waterfront, this starbucks has no sofa, comfy chairs, only table seating. i love the baristas here, but i dont like the location of the building.
this starbucks is teenytiny!seating inside is very limited.  this is a starbucks to grab and go and continue your shopping at the waterfront.baristas are friendly and fast.
im not a huge fan of this location. i think that it was oddly built the small, alleylike front makes it difficult to get past people on your way tofrom the bathroom or tables when its busy. and theres hardly any tables to sit at. furthermore, people tend to clog the front on their way in, which makes things particularly difficult especially in the winter weather. the staff were pretty impersonal to be, but maybe that was due to the high traffic of the place and the time i was there. and the coffee that i had was cold im sure it was probably the bottom of the batch. id probably only walk in here again if someone else suggested it before or after a movie or while we were shopping in the area.
this particular starbucks was especially pushy with offering extra espresso shots when placing my order. this has never happened before and it took me off guard.  the barista came off dishonest and unfriendly with the up sell push.  i will avoid this one at the waterfront for awhile.
for someone who straddles the line between sometimes crafter, this store can seem vast and confusing.  theres rows and rows of baskets and bedazzling jewels and paper and...oh my...scrap booking!  when i want to find boring old felt....its like...where do i start?  im in a hurry, as always, and i rush in and the first thing i look for is an employee.  no one to be found.  i could call out and my voice would come echoing back.  i run between rows of paper, wood and gosh darn scrap booking....no felt!  where do i find felt!  where do i find an employee!?finally, i find one after 15 minutes of wondering around.  shes incredibly nice and leads me to the felt.  this is not the first time ive been hard up to find help.  i tell her she was hard to find, and she tells me that theyre low on payroll and cant have any one the floor but her!  in that whole store, just her!  thats ridic!not a month ago i was, again, in a slight hurry and stood in line for about 15 minutes to check out, with 2 employees at the register and 6 people per line, i gave up and walked out.  hey michael, do you pick up what im putting down?  youre not making any money because your costumer service sucks....in fact, theres no service to be found!
the one good thing i can say about michaels is that they have a wide variety of hobbies and crafts included in their selection. theyve got items for woodwork, painting, knitting, kids crafts, scrapbooks, you name it. the problem is, the variety of products for your particular craft is probably dismal. theyve got lots of cool items all over the store that youre convinced that somehow you need. because it is soooo cute, and you could totally do something with it. right..? the store feels cluttered because there is so much stuff everywhere. however, if youre looking for something specific, good luck. its not even a matter of the product being difficult to find in the store. its that when you find the right section, theres either nothing in stock, or they simply dont even carry what you need. i stopped in for crochet supplies, and the yarn selection was laughable compared to many other craft stores. i ended up going elsewhere for my stuff anyway. plus the prices at michaels are significantly more than other area craft stores. i usually only stop there if im already at tend waterfront. id recommend checking other craft stores first. unless you need glitter. especially fine glitter. michaels has the best glitter selectionquality of any store ive ever been to.
well... as steak n shake locations go, this isnt the best one aroundbut it is burgers and fries that are open 247.the milkshakes are good!pros: always made fresh, when you order;cons:greasy but its burgers;takes longer than typical in drive thru but thats bc theyre made fresh!;service on a scale of 110, 10 being awesome is a 4.
in general i do like shake n steak, but this location is a hit or miss location!  you never know what kind of quality or service youre going to find here.  a friend and myself went a few weeks back after a movie and it had to be one of the worst trips there ever!  you cant entirely blame the waitress since she was the only one there for the entire place...poor scheduling on the managers part. however, while she cant be accountable for the slooooow service, she was accountable for both orders being incorrect.  the burgers were over cooked and the fries were soggie and the milkshake was runny at best...by far my worst visit to steak n shake!
rather typical sns.  had a good lunch crowd.  milkshake was good but not as good as enp down the street.  it took to long to get the burger for some reason, 25 minutes, i realized cooked to order but this is a little long for sns.  ordered the guacamole steakburger and it only had a small portion of gauc...not your usual amount..kitchen was not up to speed on portion sizing for some reason.  definitely did not look like the picture on the website.  oh well!
this place is s l o w....like so slow i have got up and left after waiting 30 minutes and not even being acknowledged by a server. the food is okay. def not worth the wait. milkshakes are just okay as well. booooooo.
i really like the chili. burgers are fair and salads are pretty bad. pretty hard to mess up a side salad. as others have said you never know what kind of service you will get. store is usually understaffed and cleanliness is fair. the staff is usually disinterested with customers and sometimes outright rude. all in all what you pay is what you get. cheap and crap service.
the food is good. unfortunately the service is very hit or miss. the main issue seems to be with the kitchen, the waiters and waitresses are often very apologetic for the long waits and its pretty obvious that some of them avoid the tables after taking the initial order to avoid hearing complaints.
this place teeters between a 2 and a 3 star review.  ive had pretty good experiences inside, its usually the drivethru where things fall a part.  its the rare place i can get a frisco melt well, the only place i can get a frisco melt!  and that steak burger alone is worth the risk, walk in or drive thru.just take a gun on weekends, youll be fine.
its okay. food is cheap but portions are small. for example i order the chicken tenders, and i got 3 little tiny tenders, and a decent amount of fries. also the restaurant is not really clean either.  this restaurant is not my number 1 choice.
i like to eat here because the food has always been good and kids eat free on the weekends which is great. but this location is always woefully understaffed, with five or six tables sitting unbussed while people wait to be seated. whether youre inside or at the drive through the wait is incredibly long. fortunately the staff are always friendly despite the ridiculous staffing levels the management maintains here.
slow service. food is very cheap though. the milkshakes are huge thick and yummy. sometimes when i go here, they completely ignore you when your the only person in line. the burgers were good and the menu is pretty small. food takes about an hour to come when no ones even there! i would go here if the service was faster and better.
another store which has gone the way of the dodo bird. actually there was nothing basement like about it. what will be done with the empty space that is the question?
9.75 for a red bull and vodka? im sorry, i thought i was in pittsburgh, not new york city. sing sing, a dueling piano bar, is fun, but it would be a hell of a lot more fun if i could have more than one watered down drink before i warbled my way through paradise city with the rest of the crowd.
in my opinion, sing sing is really not worth it. it gets expensive because you drink, maybe start to sing a few lyrics, drink some more, think of a song you wanna hear, put 5 and title of said song on a piece of paper, you drink, they play it, everyone else is trying to get their songs played so you put 10 on your next sticky note...and so on and so forth. i wasnt really into it when i first got there but as the night went on and lager went in i started to warm up to the place. i feel that if i have to drink in order to have a good time, its not worth it. but again, thats just me.the 2 stars are for the piano players, who are entertaining and very talented, and the rock bottom brews they serve.
this place has gone significantly down hill.  ive gone to sing sing about once a year for the last 6 or 7 years.  when we started going there you couldnt get a seat unless you got there early.  it was always packed.  however, each year the crowd seems to get smaller and smaller.  crowd is an important component of a piano bar due to the interactive nature of it all.  i was there last saturday night 8412 and there was about 2030 people there.  very slow and boring.  it appears the crowd is no longer allowed up on stage, taking a lot of the interactive fun out of what this place used to be.  this was likely my last time at sing sing.  save your 7 and skip this place.  a real shame because this place was once a lot of fun.
i went here with a bachelorette party. we had reservations, which was good because it was packed that saturday night. the performers were very talented, but the acoustics were strangely off.   the theme that ran through the whole show was, to quote some phrases they kept repeating, you bitch, you slut, you whore and  twinkle twinkle little slut, why dont you take it up the butt which one of the pianists wrote on the mirror at the back of the stage... you get the idea?  perhaps if i had not been the designated driver, alcohol would have made these jokes funny the fifth, sixth, seventh time. or maybe not.
this place is overrated. a friend and i were looking forward to a beer and some good bar food instead the wings were terrible and the beer was good but overpriced. theres nothing wrong with this place i just dont understand the clout around it. there should be no clout.
theres lots of potential here because of the wonderful character and ambiance of this place, but the food was average at best.  we were there on a pens playoff night and there were 2 people working all the tables in both rooms.  our food came to us cold and unimpressive at that.  our orders were somewhat mixed up.  the potato skins used a really cheap artificial cheese that was not very appealing.  i tasted a slice of pizza, which is definitely the best thing they offer.  the crust was delicious and homemade.  if you are going to order something, i would go with the pizza.  we also ordered the chicken wings which were pretty good, also.  if you are looking for good food, homestead better choices at blue dust or tin front.
ive been to dukes three times now. when i first came to pgh, a lot of locals were telling me that this was a good place to catch a game, drink some brews and get great food. most of that is true, but the bad has mostly outweighed the good.they have an excellent new tap system. last time i went, they had thirsty dog leghumpper on draft, and it was perfect. the system really elevates already awesome beer. plus, the selection is awesome. it is a sportsthemed bar, so you can expect drunk locals, loud tvs and plenty of yelling. im sort of into that, so it doesnt bother me, although i do think their staff is not well equipped enough to work among the chaos. service is often slow, and they give the waitresses zero training in the beers that they offer. this is not a good place for trying something new, as they cant tell you a thing about it. the biggest downfall of dukes, though, is the food. ive had three different, but equally simple, dishes there; a burger, a cheesesteak and chicken tenders. the first was flavorless and cold. the second was passable, but nothing special. and the last were absolutely awful. honestly, the batter and size of the chicken made me so ill, i had to call it an early night. i ate two of the 7 tenders seven! and had to quit. their fries are very good. and so are the wings.id say dukes is a good place to drink, but thats about it.
db is nice once in a while but the food is insanely unhealthy. they are also really clever about designing the psychological context in ways to extract money from their customers. you feel a bit milked afterwards. also much fatter.you pay for games using credits from magstripe cards. this lets db give their games arbitrary prices and makes it harder for you to really know how much you are spending. menus for drinks and food have no prices. 6.05 for a banana split cocktail? 3.40 for a michelob?  i have no idea whether that is expensive but not showing the prices is clever because they can price their things and not have to obey pricing psychology like anchors and so forth.waitstaff hassle you repeatedly to order desserts. oh, and the dining room has plastic demos dessert trays to get that thought going in your mind as you walk to your table.the games are all violent shooters or racing games dont appear to have changed much since 2002 when i last went to db in california. hope they can find more innovative arcade games in the future.not a pleasant experience, but at least its different from going to an ordinary restaurant.
think chuck e. cheese for adults.  skee ball, video games pool tables.  clean environment.  good fun.unfortunately, i went for a bite to eat and it was impossible to find anything good and healthy on the menu.  i ended up settling for spinach dip.  sadly, they topped the dip off with horrible orange shredded cheese that appeared to have been popped in the microwave for a few seconds.  blahhhh.  trying to get something healthy, i ordered the apple pecan salad.  i swear the dressing came right out of the grocery store bottle.  i could barely eat the salad.  too sweet.my mom ordered a steak roll.....holy friedness!  the steak was more like hamburger fried with cheese and then stuffed into breading that was fried again!  yowzer!  artery clogger for sure.  i like the atmosphere.  i like the bar area.  perhaps next time well just stop by for drinks instead.
dave and busters is an enigma, is it dining, a bar, or  playground for video game lovers? let me get the bar part out of the way first, its overpriced, and they try to get you to buy a glass to jack up your bill. next, the food. just like all the chain places at the waterfront, there are sandwiches, burgers yes they have a blue cheese burger, who doesnt? pasta, salads, chicken fingers, yadda yadda. the games, i swear over three quarters of the games have been there since 2000 when the place opened. i guess in ten years no new games have hit the scene.overall dave and busters is unique to the waterfront, but its time to update the menu, update the games, and get into the second decade of the 21st century.
not much of a review for this one, but just a few tidbits of info...pool on fridaysaturday is 14 per hourim pretty sure its 10 through the weekmixed drinks are way too pricey for the location.the food is crap.the games are fun and the pool tables are nice theyre the big tournament stylesize, not the shitty barroom, tiny pool tables.that is all.  :the pricing is based on my recent trip.we shot pool for a few hours, i had a bar tab that wasnt out of control and my night ended up costing me 60
when did dave and busters become a daycare?? everywhere you look, there are signs that say kids must be accompanied by an adult, but apparently no one was honoring that at 6pm on a saturday. i couldnt even walk through the place without someone shoving me. ahhh!i get that dave and busters is an arcade and that youre going there to play some games, maybe eat, and kill some time. when i last went there a few years ago, we there for my bachelor party, and while im sure we got into some shenanigans, i dont remember children running wild there. we were having adult beverages, playing games, and having a good time. this time, it was ridiculous. it isnt chuck e. cheese, yet thats how parents seem to be treating the place.on top of that, the customer service sucked. the place is gigantic, with tables and serving areas everywhere, yet on a saturday at 6pm, the hostess told us after interrupting us three times to chat with the other hostess told us it would be a three hour wait, despite the fact that there were empty tables all over the dining room. i suspect this is a ploy to get you to play games and spend money until youre table is ready, but the food at dave and busters is not worth a three hour wait on any day.the hostess told us we could be served right away if we went to the midway and found an empty table, so we attempted that. most of those tables were empty with usually one or two adults at a giant empty table filled with coats who informed us that they needed the table because their kids would be back soon after playing games. next, i engaged in the most rudest thing ive ever done i began stalking tables where people were finishing up. i would walk up to people paying their check, ask if i could have their table when they were done, and they would inform me that there were already two or three people who asked them and i should get in line.finally, we found a table and proceeded to spend two hours eating dinner. it wasnt because we ordered a lot of food it was that the waiter took forever to bring our food out. he seemed to have no problem getting us fresh drinks, until we drank as much as we could and then asked for water. after that, he seemed to come around a lot less. i had the build your own chicken tacos, which comes on a giant plate with all kinds of fixings. the fixings were fresh, but the chicken was cold and dry, and the tortillas were dried out as well. for 14, it wasnt worth it. after dinner we proceeded to play games, which entails shoving people to get through areas and waiting in line to play anything. all in all, i didnt like my experience at dave and busters. i remembered it being a fun place to go and unwind as an adult. but between all the kids and the crappy service, cant recommend this place. if anyone asks me to go back, i may elect to stay home and poke my eyes with a fork.
not being from the area, i traveled an hour to come here from uniontown, pa. i was excited! i havent been to this dave and busters since i was younger and was ready to go back and play me some games! i went with my cousins, mind you, we hadnt ate all day and were very hungry. so, we decided to do the eat  play combo, naturally. heres where it gets bad. first of all, we get a very snobby hostess that shows us to our table. then, we wait...and wait...and finally after about 25 mins we get a waitress. her name was ashley. we had plenty of time to decide what we wanted, so we quickly put our order in. next, we were sitting and talking, waiting, we had empty glasses and our waitress had never even come around to see if we needed refills except for one time. she said shed come back right away with our refills...yea, right. 20 mins later we get our refills. mind you, our food still hasnt came yet. i see other people getting their food that had come in after us. i was frustrated. after waiting 45 mins for our food, i asked to speak with a manager. one of the servers who i asked replied rudely with well, hes really busy right now. i doubt hell be able to come out and talk to you. finally, 15 mins later...thats one hour, folks. we get our food. what do you think the next problem was? yep, the food was cold. i was completely fed up at this point, and told my waitress how disappointed i was, especially after driving one hour just to have this terrible service. the manager never came to speak with me, and we didnt even receive our meals for free. the only compensation we got were 10 game cards. wooptydoo. the only thing good about this place is the games, but the prizes you get for your tickets are all junk and worthless. so, in conclusion...i do not recommend the waterfront dave and busters of homestead, pa. it was horrible, and i will not be returning for a very long time!
my boyfriend and i are in our 20s, and have visited this db multiple times. after our visit yesterday, however, i dont think well be back. when we arrived we were greeted by a long line of people waiting to buy game cards. at first there were 2 extremely slow workers trying to do this, then one left while the line was still out the door! the girl that was left was more than incompetent, and was taking extremely long to fill these game cards. we stood in line for over 20 minutes before being told that there was another attendant in the actual game room. needless to say, the line in the game room was just as long, and they still only had one girl in the booth. it was a saturday! after we finally got our cards we had to wait yet again to get a beer. 2 bartenders on staff while the bar was completely full. it took us almost an hour before we actually could start gaming. the floors were filthy with trash, and the bathrooms: repulsive! i had to use the restrooms twice during our visit, and not only did both bathrooms i used have no toilet paper in them, but there was tp all over the floors, and the sinks were less than cleanly. my boyfriend mentioned that the guys restroom was no better, as it smelled like pee and the paper towel dispenser didnt work. all i have to say is get your crap together. we could see a difference in the type of crowed that was there on saturday compared to what it used to be, and im i have no doubt its due to the poor service and attention to cleanliness. for how expensive they are they need to staff better on weekends. its a shame how quickly this place has gone down hill and we will not be returning anytime soon!
ok! let me tell you about my bad experience first. i went to db last night for a post wedding party  which, side note, is a great idea!it was around midnight and the bar wasnt really populated. there were three bartenders and only one was actually making rounds to see if anyone needed anything. the two other bartenders were chatting on the far side of the bar that no one was sitting at. kind of counter productive if you ask me. i stood there for about 5 minutes, which for a busy bar is fine but when i am the only one with my card out then, it just seems a little ridiculous. i made eye contact with the one girl twice and gave her a smile and she literally turned away. i finally had to walk to them to get their attention.  i was standing right in front of them smiling and they didnt ask if i need anything. i finally said, are you working? and they gave each other a weird look. i felt like i was the crazy one. i asked for a beergot the beer.in between that time, the other bartender brought food over and set it down. she took a fry from the plate right in front of me and then served it to someone on the other side of the bar. what the hell! i felt like i was in some grimy bar in out in the sticks  not an established db. i was just really turned off from that experience. the good is that db provides a different type of entertainment when you want to mix things up. i remember going here with my grandparents when i was a kid and it was the best treat ever! we would eat at the restaurant and then spend hours playing games. this place holds some really good memories for me. its a shame that my experience last night has spoiled the high standards i held for it.
i used to love db when it first opened in the waterfront, but it has gone down hill over the years. the games are not as fun and do not give you as many tickets and the prizes have gotten cheaper in quality. it takes a whole heck of a lot of tickets for you to even get a pencil! the atmosphere is okay but it used to be so much better with the funnest games and diverse groups of people! now, it is run down and many of the games are app related games fruit ninja and 3d experience rides. with such games, you cant even earn tickets and they take a lot of tokens! last time i went, back in the winter, many of the games were broken, which made for a negative player experience. i would go to db to play some games again in the future, but it is no longer one of my favorite places to go due to the decline of fun games where you can earn tickets.
i recently stopped there with my girlfriend and her kids to celebrate her daughters 21s birthday. i ordered the fish and chips. dont order the fish and chips unless you want to lube your insides for months. i know i probably got the one that got away and they refried it 3 times. the outside breading was hard as a rock and had no taste. the fish itself was bland. after a few bites i called over the waiter who was very nice and funny and complained by showing him how hard the fish was by tapping the fish against the plate making a loud thud noise. he grabbed my plate and took it to his manager. but before doing so asked if i wanted something else i said no i had lost my appetite. the manager came out looked around and walked right out of the area. i was thinking he would have stopped but didnt oh well. the waiter took my meal it off the bill. i have eaten there before and the food was good. sometime you just get one that isnt.
my sister and law wanted to go here for lunch so all the kids could play games after we all had some lunch together. this place is huge and was moderately clean except the bathrooms. all of the food looked great on the 16 page menu. when our food came though, everything was below average. they have a huge selection of games for the kids to play, but you pay dearly to play games here. the food is  overpriced and the drinks are drastically overpriced.
