after waiting for almost 30 minutes to trade in an old phone part of the buy back program, our customer service rep incorrectly processed the transaction. this led to us waiting another 30 minutes for him to correct it. dont visit this store if you want pleasant or good service.
very disappointed in the customer service. we ordered reubens  and wanted coleslaw instead of kraut. they charged us 3.00 for the coleslaw. we will not be back . the iced tea is also terrible tasting.
i will start by saying we have a nice new deck. that is where the good part ends.why two stars if we have a nice deck now? well, it all started in may when we had a man named al come out and talk to us about the process. he was a true salesman, ill tell you that. not a straight shooter, but an excited salesman that wanted to sell... and we bought into it.he told us they were backed up with the harsh winter and a lot of jobs, but they could probably start by june 24th. mind you, this was the end of may we met with him. he said they would have to do a survey of our land and get a permit from dormont before they started. we felt confident in going with them, and booked it.heres where things fell apart. weeks went by with no word from them on the process. finally i called and left messages. al finally got in touch with me and the conversation was utterly confusing. he must have not understood me because he just kept talking in circles. so i hung up not knowing what was going on. finally i called back and the admin told me that the survey could take a couple weeks to come back. i wish al would have told us that.so our june 24th date came and went. we finally got our survey. and they were quick to bill us for it, but no word on where we were in the process. i called back a couple times with no real answers from the admin. apparently they were now waiting for the permit from dormont.a month later, i was frustrated and asked to speak with someone at the company. i spoke with someone who told me that dormont usually takes a week to process the permit, but we were now going on a month. he told me he would bug the guy about it and we finally got it. i completely understand that waiting on the permit is not their fault, but why no communication about it? just call me and tell me theyre waiting for the permit, but theyll work towards asking dormont what the hold up is. seems simple.finally we get the permit and work is supposed to start. tuesday comes and they have to wait for approval from dormont on holes theyre digging. so holes are dug and equipment is put in my backyard and then nothing happens for two days. where did everyone go? who knows, because i wasnt informed! i was upset and contacted the company owner, dave, by email. i told him how frustrated i was about the lack of communication. he wrote me two sentences that  said there will be acres there tomorrow morning to finish and most will be done tomorrow. well, that didnt happen.then two other dudes show up two days later and did work for about three hours and left. the main guy comes back the next day and says they did it wrong. so apparently the part about how they wouldnt need access to my house changes to theyre drilling bolts into my house to secure he deck. finally, the second week into construction, my tiny 10x11 foot deck is done. it was upsetting that they left the deck dirty, and all the dirt and cement they moved around wasnt cleaned up. i even asked them to fill all the holes they dug up and didnt use, and they only filled up one. when you create a construction project, isnt it just good business to clean it up and make it look nice? didnt happen here.my main point is, contractors have a reputation for not being the most trustworthy. why be that company? why not be an upstanding company that consumers can trust? my main issues with them were that things were not communicated to me properly up front, nor was the ongoing process communicated to me. then they left everything unfinished in my eyes, leaving the site dirty. i understand things happen and things get delayed, but just email or call me. its not that hard to keep me updated, it is 2014 with a million ways to be contacted.even though i have a nice deck after i clean things up myself!, i would not recommend them to anyone.
hoofah.
average run of the mill store.  associates are young teens and they really dont know where anything is.  luckily i am able to get around to find everything.  found my puppy treats and moved on.
real talk: i took my car through the carwash here once, got a nasty gouge down the side, and the guy at the counter didnt seem to care. the car wash has since been decommissioned, which is totally ok because the getgo carwash across the street is excellent and better in every way.
two meals, on the recommendation of a friend who lives near the place, and after the second trip, i was compelled to write. rocky would definitely describe the experiences.on the first trip, i went to try their at that timeraved about reuben. and yet to find a true good reuben in da burgh, i tried it.well, they were out of the proper bread, and the guy had to run to the store to buy the closest thing he could find, which was not the proper bread, and instead of one of their raved about reubens, i received two minireubens, which basically took the guts from one reuben, and spread it out onto two sandwiches on regular sized bread. i ate it. it wasnt great, but they swore it was because theyd run out of the bread. bread or not, it still wasnt great. the atmosphere was pleasant in that blue collar bar kind of way, and the staff was very nice, but not a winning pitch on the reuben.the second trip was after a long day of moving furniture with the same friend. sat in the back room, instead of the bar, which felt more like a restaurant, of course, with the big screen tv covering the sports of the moment.i was in the mood for dinner this time, and after a scan, decided on fried chicken and mashed potatoes with the salad bar. my friend ordered one of her faves, the breaded pork chops.we hit the salad bar, which was uberbasic. three soups mostly vegetable loaded, which left me out, basic iceberg lettuce mix very probably out of a bag, a few veggie toppings, and three or four dressings. it was a basic salad, no big deal. more or less an appetizer filler before the meal.the mindblower in this trip was the ordering of the fried chicken dinner. our waiter looked like a 19 year old gas station attendant, skinny little blonde guy with a sweet but incredibly naive face, and an air of vapidity, which was confirmed when i placed my order. i asked what chicken pieces came in the dinner, and asked if it was possible to only get dark meat. i never imagined how confusing a question that could possibly be. it literally took him two trips back to the kitchen to ask, and the child honestly had no clue what white meat and dark meat meant. the first answer he came back with was that the chicken came in a preportioned prepared bag, kind of kentucky fried chicken style...which didnt answer my question, thus prompting the second trip. after the second trip back i heard the cook holler tell him ill fix him up. well, the chicken was prepackaged dreck like youd find in the freezer case of walmart, tiny and not good, and the potatoes had that slight tinge of chemspuds flavor, laden with some kind of chopped up green parsley?, and a side of that basic brown gravy served up in 5 gallon buckets.thank goodness for the basic salad bar.even my friend admitted that her pork chops were different and not what shed expected. they also appeared to be from a freezer bag.the irony was that the boy who didnt know white meat from dark meat, was chatting with some other customers...about baseball...and he was a genius about the mindless sport of baseball. ahhhh da burgh.third base? nah...why bother when there are so many other options around. go on in a grab a beer and chat black and gold if you happen to be in carnegie...they can help you out all types of ways in that area. just dont go hungry if you actually have tastebuds.from what i understand it used to be really good homecooked food. but apparently, mama has left the kitchen.
we came here once before and remember it not being very good, but figured wed give it another shot since its pretty close to our home. its still just ok. we didnt have to wait this time saturday morning at 10:30, but there was a wait throughout the time we were there. the menu is very basic no specialty pancakes, waffles, or french toast and only 1 specialty omelette. there were no meal options, so if you want home fries or something, its extra. the omelettes do include toast. great bread, btw! we had to wait a while for our food, which was surprising because weve been to a lot of diners. my husband and i both got omelettes and agreed that the contents were not really cooked with the egg. its almost like the egg was completely cooked and someone threw the cooked contents in there and just folded it over. as for my mushroom and cheese omelette, the cheese was lacking. my biggest peev about this place is that its cash only. perhaps i missed it, but im pretty sure this wasnt noted anywhere on the menu or the front door. thankfully, we had enough to cover our bill, buts not a good way to end the meal when youre scrambling and digging for change. there are a lot of good diners in the area, so i doubt well be going back.
my first time going to barbs country junction and i really wanted to like this place, i really did...however, i didnt.the food was decent, some was above average and some below but it was overall decent. i got pancakes, bacon and eggs. the pancakes were really good and fluffy, the home fries were simply okay and the eggs were not cooked well. my son had a burger and it was good. the coffee at this place was brewed to perfection which a appreciate. i would give the food 35.the service was subpar for sure. while our waitress was a really nice girl, she wasnt on top of anything at all. had to ask for coffee refills, had to ask for silverware, for napkins...etc. she got the order messed up and so on. i give the service 25.the inside of the place had some country charm as youd expect but want particularly cleanly. it also had a leaky roof in several places which had buckets collecting the water. a customer even tripped over the buckets and fell. i give the interior 25.the prices were decent. i fed my whole family breakfast 3 of us for 23. i give the prices 35.so in summary, you can get okay food here for a rather cheap price but it is not a great place to dine in by any means. there are better diners in the area that i will patronize in the future rather than barbs.
it looks so much better in here since they changed from paddys to rileys. its a shame, however, that they had to keep that same curmudgeon of a bartender that ruins the experience. can somebody notify me once they get rid of him?
okay, so hopefully you havent been enjoying happy hour  rileys pour house before you read this or you might not be able to follow the lilting irish owners. to recap: murphys pour house from 19791985. sullivans pour house from 19952002. paddys pour house from 20022012. and, bagpipe please, rileys pour house opens march 1 of 2012. still with me?its a tiny long bar just like the old irish pubs. no more smoking allowed. hurrah!!!  same lousy service. my guess is that the entire place needs no, strike that .... demands an automated foodbeverage ticketing system. none of the cooks, bartenders, or waitresses know who ordered what nor what ticket belongs to which table. its actually pretty funny if youre not a hungry or b thirsty. i really really want this place to do better. we need more irish pubs and local old time watering holes. get it together, murphys ... er, i mean sullivans....er, i mean paddys or is it rileys? ;  .  whatever the case, they have cold guinness. and irish music.  and fun patrons.
i love ljs, but i  had to write a review regarding this particular location.  the inside is very dated and appears to be poorly cared for.  it smelled like burnt fish when we walked in the door.  it took about 15 mins for the food, so i figured it was gonna be all fresh...negative!  the fish was old and cold and fries were a very soft.  the corn lacked butter.i didnt care for the onion rings and my boyfriend said the coleslaw tasted spoiled.the chicken planks and hushpuppies were the only things edible.  service wasnt too bad  nice people.  too bad a whole bunch of flies started flying around the dining area and prep area, which ruined my appetite.
far away from real chinese food. doesnt even taste good as american style chinese food.
i used to order takeout here once every month or so. the food tastes average and the price is good. its your typical lowend chinese place. the last and final time i ordered here i just so happened to be picking up my order while a health inspector from allegheny county health department was making his rounds. while i was waiting on my food which took much longer than usual the inspector was pointing out violations. he also requested a copy of a certificate that the man behind the register was unable to produce. the inspector looked at me like i was crazy for waiting on my food despite the obvious poor conditions.  as for the rest of the place  its always been kind of dirty inside. the carpets are just filthy and the walls match. there are always childrens toys scattered about the floor because the owners children are always there, so be careful not to trip. the workers do seem like nice people just trying to make a living but when it comes to cleanliness don don is lacking.
i bought a three month membership last year, mainly to attend the silver sneakers classes. i was in my early sixties and hadnt exercised in a while. i tried the evening classes but they were very crowded and difficult, so i tried a morning class for seniors. i like to stretch out before my class actually starts, so i went to the tail end of a yoga class. the women in this class were very nasty to me and told me that i wasnt welcome to stretch out in their class. i never went back thanks to the attitude of the other members. i didnt feel welcome here. i complained to the manager, who said that i was welcome to stretch out in whatever class i wanted to, but the hostility of these yoga students was very evident. do they think that this is their private gym?
i have to say that i write this review with much regret, because i have always loved papa js. but my recent experience there has changed my mind a bit. from the minute we were seated, we were greeted by a server that was clearly inexperienced and didnt know the menu. as i said before, ive been to papa js a good handful of times so i know the menu decently well, but the server couldnt explain any of the questions i had about a couple new dishes i was thinking about trying. i swear this guy must have just looked at the menu for the first time a few minutes ago.but it wasnt just the knowledge of the menu. it was one thing after another with our server. my wife asked for a glass of water 4 times until she finally got it at which point the meal was over, so we didnt care at that point.  i mean come on, for a restaurant of this calibre and price is it too much to ask for a glass of water? there was no one filling up water.my biggest complaint, however, is what happened with our meals. my dad and i both ordered the trout special trout with roasted red peppers and lump crabmeat. instead, the meal that was delivered to both of us was trout with a heaping pile of spinach and mushrooms. not what the special was at all.  and by the way, that item is on the menu as a regular item so whether or not the mistake was made by the server which, we are sure it was or the chef, who knows for certain. not to mention, though, that a good server wouldnt have served us that regardless. but before you think we had an unusal experience that was all due to a poor server, let me continue. when we informed our server of the mistake, he didnt really believe us until he checked his order sheet, and then he blamed the error on the chef. at this point, the meal had been sitting because it took us forever to flag this guy down again so the trout was basically cold. the server then said he would have the meals remade. so, he took the meals back to the kitchen. meanwhile, of course, my wife and mom are eating their meals and my dad and i are sitting there with no meals. also keep in mind that my wife still had not gotten the water she had been asking for, and my iced tea had been refilled with a soda yes, believe that or not. all the kitchen did was scrape their mistake off of our fish! they didnt remake anything. our fish was served to us again with little pieces of spinach and mushrooms sticking all over it. quite frankly, the fish wasnt good at all. i honestly would have rather had a fish sandwich from mcdonalds that night. the server never did anything to try to make our experience better  he knew we werent happy, but never offered anything such as dessert on the house. im not looking for a handout, but our experience was just plain awful that night. the guy never really even apologized for the mistake. normally, i may have asked for a manager, but at this point i was ready to just get out of there plus, we had to be somewhere else that night.my opinion... for the money, there are many other restaurants i would rather eat at.
coming here you get the feeling they havent changed much.  the tables, the decorations, the menu.  all the same.  does that make you a little worried?  yes.i ordered the mushroom ravioli and it was... oily.  very very oily.  the actual ravioli was okay, enough mushrooms.  but it was oily.  did i mention that?  ambiance, like i said, left much to be desired.  i dont think id have this place on my list of musts for downtown.  much better restaurants to visit!
service in this place is poor because of lack of acknowledgment since people working there are just working . they have nice decor,nice bar and good bread. consider where this place is ,the prices are really really high . nothing is served on the side with main dishes ....
although the first impression through the door is charming and the aroma enticing  as you enter this restaurant much can be improved upon for the prices asked for the dining experience. our group of 7 had called a week ahead and were seated in the back of the far dining room, right by a door where clinking pots pans and  dishes were heard throughout our meal, as well as a darth vader type noise coming from the ceiling vent. our waitress was not knowledgable of all menu items, and three of our  very simple requests did not come out as ordered.  dressing on the side of a salad,  less feta on an entree and no oil on another entree the waitress blamed it on the cook, but did offer to get one entree changed. also we were asked if we wanted pine nuts, feta or gorgonzola on our salad and then were charged 2.00 extra per item in addition to the salad price 6.99 which brought the salad up to 10.99 ! outrageous !there is so much possibility for ambiance in this restaurant , but they miss the mark on service and atmosphere. i will most likely not return. very overpriced for the quality and service.
papa js is expensive and inconsistent.  the ambiance is nice but it doesnt justify the prices.  there are better restaurants in carnegie.
man has this place gone down hill.  my husband and i went a couple of weeks ago.  we had salads and pasta.  both were on the verge of inedible.  with a single glass of wine, i felt downright robbed at the 50 price tag.  seriously, i could have easily made what we had with jarred sauce and boxed pasta at home. classico is better.  and the service was pretty absent to make it even worse... seemed she knew it was terrible and didnt want to deal with it.  seriously, id rather eat at the og.
once upon a time, papa js was a great place to eat. great food and knowledgeable wait staff.unfortunately, after a couple of very unsatisfactory meals we will not be going back. looking for a great italian meal? look elsewhere.
our pizza was cold and our drinks where empty.  we are not going back.!  the waitress started as attentive, but slowly slipped away to the point where things became frustrating.
i struggle to write this review simply because this dining experience confused me. first, the restaurant itself is on a convenient corner st in downtown carnegies main street. when you walk in you the first thing you see is a counter filled with desserts and amazing looking house made breads. it rather looks like a deli counter. you have to walk around to get to the hostess station and then can go left to the bar or right to the dining area. a bit confusing layout, but tastefully done. the dining area is brighter than the rest of the restaurant. it felt much more upscale once in the dining area, but i did find the overall restaurant tastefully unique. the food  a wide range of italian dishes and seafood. we ordered the crab hozel as an appetizer. it was an average serving of lump crab meat, i had to ask for cocktail sauce. it was tasty, but cost us 18. we then ordered the veal and shrimp entree with sauteed veggies like artichokes, eggplant, peppers, etc. there were 4 smaller sized cutlets of veal and 3 shrimp. 28. there was no salad or pasta side offered. the dish was prepared properly and was ok. we just felt it needed something else. now the bread that was offered to our table came in a small basket and was filled with a variety of their house made breads. the pepperoni bread was amazing! i mean really delish. this alone i would have given 5 stars. the service  our server was...well....im not sure what he was quite frankly. annoying?confused? hyper?  he appeared to have no idea what he was doing half the time. bouncing around the table, asking the same questions over and over, forgetful, spastic, etc. at one point one of my colleagues said, is he on crack? we chuckled, but seriously! he forgot to even ask us if we wanted dessert, which was too bad because we saw some amazing looking offerings in the cases as we were leaving.overall  if i were in the area again i would definitely stop in to get some pepperoni bread to go, as they do sell it by the loaves. however, i think i would try somewhere else to dine.
ok a few things. first we walked in and asked for a table and was told it would be 5 mins. so after 10 mins, we were seated and there was 10 tables that were open! why the hell was there a wait??? the older man that took us to the table could have done nicer. the bread was great and that was about it. the food was not bad but it was not good.
i wrote a letter to the papa js, but did not receive a reply therefore i will share my experience online.tonight a friend and i dined at your location. we were seated in the bar area by the sidewalk, which is what we requested because of the great weather and the happy hour specials. our server took our order of a gingerale, fried zucchini appetizer, side salad, wedding soup , eggplant rolotini and chicken piccata  correct spelling.we thoroughly enjoyed the bread  wedding soup.the side salad was rather bland and unexciting, lacking flavor  texture. the spring salad consisted of leaf lettuce, a single slice of tomato and one black olive. i would have expected some additions such as onions, peppers, cheese, cucumbers, croutons, carrots and the like.   we enjoyed the fresh air while waiting for our appetizer, but were growing concerned that it would arrive too close to the meal, so we asked the server  bartender  about the appetizer and he told us that he had forgot to put it in. he offered to put it in at this point, but advised us that our meals would be out soon. we decided to just wait for our meals and forgo the appetizer which were looking forward to.    the main dishes were acceptable, not outstanding. the eggplant was very tasty and well prepared.  the chicken piccata was flavorful, but not as expected.the chicken seemed to have been steamed or baked. it had no signs of being coated and sauteed  to a rich golden brown. the chicken was just pale white.the sauce was a simple lemon flavor, it lacked any depth that would have resulted from the browning of the chicken. i tasted no garlic or shallots. the sauce lacked that famous tang usually supplied by capers, which were absent.  no pasta was served with the chicken. the side of vegetables were well cooked, buy again lacked any real flavor. the would have benefited from a roasting which would have produced a rich savory taste produced by extraction of the natural sugars.  once our meals were finished  our plates were taken and we waited another 20 minutes for the check. the server seemed more concerned with what was on television rather than his customers. the total was 43 and change.i would have expected the salad and soup would have been removed from the bill for the error of not putting in our appetizer order, but no such offer was made and i saw no manager come around and check on the customers, as is customary.i am hesitant to go back to this restaurant or  recommend it to anyone after tonights dining experience.  i hope this feedback will be beneficial to your business.
typical starbucks coffee chain. 2 things i dont like about this starbucks: 1. ive been there twice and both times the place has been dirty, compared to the other starbucks i have been in.2. if you have to use the bathroom, they give you a key thats attached to this nasty bottle. im pretty sure they dont clean that bottle after every use or even nightly.aside from that, good coffee and fastfriendly service.
